{
  "$schema": "./schema.json",
  "schemaVersion": 1,
  "id": "capture",
  "displayName": "Quipsly Capture for iPhone and iPad",
  "ownerSurface": "capture",
  "status": "active",
  "applicationRoot": "apps/mobile-capture/HighGroundCapture",
  "changeDetection": {
    "deploy": {
      "prefixes": [
        "apps/mobile-capture/HighGroundCapture/"
      ],
      "files": [
        ".github/workflows/capture-pr-tests.yml",
        "release/manifests/capture.json"
      ]
    },
    "validation": {
      "prefixes": [
        "release/app-store/quipsly-capture/",
        "scripts/release/quipsly-app-store-connect-",
        "scripts/release/quipsly-capture-",
        "scripts/release/quipsly-testflight-",
        "scripts/release/quipsly-xcode-cloud-"
      ],
      "files": [
        "scripts/ci/capture-ci-routing.test.mjs",
        "scripts/test-capture-session-deep-links.sh",
        "docs/quipsly/xcode-cloud-usage-policy.md",
        "docs/quipsly/hgo-testflight-rehearsal-runbook.md",
        "docs/quipsly/ios-capture-app-review-notes-draft.md",
        "docs/quipsly/ios-capture-app-store-listing.md",
        "docs/quipsly/ios-capture-app-store-readiness.md",
        "docs/quipsly/ios-capture-privacy-label-matrix.md",
        "docs/quipsly/ios-capture-reviewer-smoke-checklist.md",
        "scripts/quipsly-hgo-rehearsal-live-preflight.sh",
        "scripts/quipsly-hgo-rehearsal-preflight.mjs",
        "scripts/quipsly-hgo-rehearsal-preflight.test.mjs",
        "scripts/quipsly-ios-capture-app-store-static-smoke.mjs",
        "scripts/quipsly-mobile-provider-room-static-smoke.mjs",
        "scripts/release/quipsly-app-store-connect-assign-build.mjs",
        "scripts/release/quipsly-app-store-connect-assign-build.test.mjs",
        "scripts/release/quipsly-app-store-connect-external-beta.mjs",
        "scripts/release/quipsly-app-store-connect-external-beta.test.mjs",
        "scripts/release/quipsly-app-store-connect-readback.mjs",
        "scripts/release/quipsly-app-store-connect-readback.test.mjs",
        "scripts/release/quipsly-capture-app-store-metadata.mjs",
        "scripts/release/quipsly-capture-app-store-metadata.test.mjs",
        "scripts/release/quipsly-capture-release-target.mjs",
        "scripts/release/quipsly-capture-release-target.test.mjs",
        "scripts/release/quipsly-testflight-public-link-readback.mjs",
        "scripts/release/quipsly-testflight-public-link-readback.test.mjs"
      ]
    },
    "schema": {
      "prefixes": [],
      "files": []
    }
  },
  "artifact": {
    "kind": "ios-ipa",
    "identifier": "com.highgroundodyssey.HighGroundCapture",
    "sourceRevision": "git-commit-sha",
    "materializer": "scripts/release/quipsly-capture-release-from-commit.sh",
    "provenanceReceipt": "capture-release-receipt.json"
  },
  "proofs": {
    "source": [
      "scripts/release/quipsly-capture-release-from-commit.sh release --revision <commit-sha>"
    ],
    "deterministic": [
      "apps/mobile-capture/HighGroundCapture/scripts/run-fastlane.sh verify",
      "apps/mobile-capture/HighGroundCapture/scripts/run-fastlane.sh ui_test",
      "bash apps/mobile-capture/HighGroundCapture/scripts/capture-app-store-draft-screenshots.sh"
    ],
    "localRuntime": [
      "Install the signed candidate on a physical supported iPhone and complete note, task, project, tag, and recording workflows."
    ],
    "credentialedRuntime": [
      "Sign in to production Nest with a reviewer account, upload a real disposable capture, and read back durable ownership and processing state."
    ],
    "deliveryReadback": [
      "Read back App Store Connect processing, install the exact TestFlight build, and repeat the critical physical-device workflow."
    ]
  },
  "delivery": {
    "channel": "app-store-connect",
    "target": "Quipsly Capture / TestFlight and App Store",
    "promotion": "manual"
  }
}
